ID,Name,Stars,Forks,Size,"Programming Language","Default Branch",Topics,"Open Issues",License,"Repo URL",Owner,Website,"Created At","Updated At"
126577260,trekhleb/javascript-algorithms,190210,30497,13564,JavaScript,master,"algorithm, algorithms, computer-science, data-structures, interview, interview-preparation, javascript, javascript-algorithms",357,"MIT License",https://github.com/trekhleb/javascript-algorithms,https://github.com/trekhleb,,2018-03-24T07:47:04Z,2025-02-25T01:49:37Z
2126244,twbs/bootstrap,171621,79022,253962,JavaScript,main,"bootstrap, css, css-framework, html, javascript, sass, scss",676,"MIT License",https://github.com/twbs/bootstrap,https://github.com/twbs,https://getbootstrap.com,2011-07-29T21:19:00Z,2025-02-25T01:13:09Z
23088740,axios/axios,106365,11011,17172,JavaScript,v1.x,"hacktoberfest, http-client, javascript, nodejs, promise",667,"MIT License",https://github.com/axios/axios,https://github.com/axios,https://axios-http.com,2014-08-18T22:30:27Z,2025-02-25T01:08:14Z
3470471,FortAwesome/Font-Awesome,74690,12199,132252,JavaScript,6.x,"css, font, fontawesome, icons, svg-icons, svg-sprites, webfont",4123,Other,https://github.com/FortAwesome/Font-Awesome,https://github.com/FortAwesome,https://fontawesome.com,2012-02-17T14:19:43Z,2025-02-25T00:52:17Z
278335273,anuraghazra/github-readme-stats,71619,23898,5913,JavaScript,master,"dynamic, hacktoberfest, profile-readme, readme-generator, readme-stats, serverless",388,"MIT License",https://github.com/anuraghazra/github-readme-stats,https://github.com/anuraghazra,https://github-readme-stats.vercel.app,2020-07-09T10:34:22Z,2025-02-24T22:23:50Z
3678731,webpack/webpack,65061,8952,67164,JavaScript,main,"amd, build-tool, commonjs, compiler, es2015, es6, esm, javascript, javascript-compiler, javascript-modules, loaders, module-bundler, plugins, web, web-performance, webpack",234,"MIT License",https://github.com/webpack/webpack,https://github.com/webpack,https://webpack.js.org,2012-03-10T10:08:14Z,2025-02-25T01:21:03Z
147350463,leonardomso/33-js-concepts,64701,9059,1512,JavaScript,master,"angular, concepts, es6, es6-javascript, hacktoberfest, javascript, javascript-closures, javascript-engines, javascript-programming, nodejs, primitive-types, programming, react",83,"MIT License",https://github.com/leonardomso/33-js-concepts,https://github.com/leonardomso,,2018-09-04T13:27:04Z,2025-02-25T00:28:44Z
460078,angular/angular.js,58758,27434,101796,JavaScript,master,,463,"MIT License",https://github.com/angular/angular.js,https://github.com/angular,https://angularjs.org,2010-01-06T00:34:37Z,2025-02-24T16:03:02Z
138839979,scutan90/DeepLearning-500-questions,55438,15939,207074,JavaScript,master,,120,"GNU General Public License v3.0",https://github.com/scutan90/DeepLearning-500-questions,https://github.com/scutan90,https://github.com/scutan90/DeepLearning-500-questions,2018-06-27T06:36:45Z,2025-02-24T21:17:20Z
53809090,juliangarnier/anime,50923,3701,49278,JavaScript,master,"animation, anime, canvas, css, javascript, javascript-library, svg",234,"MIT License",https://github.com/juliangarnier/anime,https://github.com/juliangarnier,https://animejs.com,2016-03-13T21:37:45Z,2025-02-24T23:50:33Z
1424470,moment/moment,48073,7054,22191,JavaScript,develop,,275,"MIT License",https://github.com/moment/moment,https://github.com/moment,momentjs.com,2011-03-01T02:46:06Z,2025-02-23T17:24:46Z
46629305,NARKOZ/hacker-scripts,48008,6650,105,JavaScript,master,,68,,https://github.com/NARKOZ/hacker-scripts,https://github.com/NARKOZ,,2015-11-21T19:05:09Z,2025-02-24T22:26:00Z
58836534,algorithm-visualizer/algorithm-visualizer,47149,7335,21182,JavaScript,master,"algorithm, animation, data-structure, visualization",67,"MIT License",https://github.com/algorithm-visualizer/algorithm-visualizer,https://github.com/algorithm-visualizer,https://algorithm-visualizer.org/,2016-05-15T00:27:45Z,2025-02-24T18:09:46Z
34302698,serverless/serverless,46599,5735,100191,JavaScript,main,"aws, aws-dynamodb, aws-lambda, azure-functions, google-cloud-functions, microservice, serverless, serverless-architectures, serverless-framework",1234,"MIT License",https://github.com/serverless/serverless,https://github.com/serverless,https://serverless.com,2015-04-21T03:48:40Z,2025-02-24T22:05:03Z
3214406,meteor/meteor,44571,5205,133504,JavaScript,devel,"build-system, framework, hacktoberfest, hacktoberfest2023, javascript, meteor, mongodb, nodejs, npm, react, reactive-programming, realtime, rpc, zero-configuration",358,Other,https://github.com/meteor/meteor,https://github.com/meteor,https://meteor.com,2012-01-19T01:58:17Z,2025-02-24T20:33:01Z
99598595,parcel-bundler/parcel,43681,2267,58027,JavaScript,v2,"assets, build-tool, commonjs, compiler, css, es6, html, javascript, module-bundler, modules, web",617,"MIT License",https://github.com/parcel-bundler/parcel,https://github.com/parcel-bundler,https://parceljs.org,2017-08-07T16:36:47Z,2025-02-24T22:33:04Z
255378816,bigskysoftware/htmx,43677,1416,97093,JavaScript,master,"hateoas, html, htmx, hyperscript, javascript, rest",608,Other,https://github.com/bigskysoftware/htmx,https://github.com/bigskysoftware,https://htmx.org,2020-04-13T16:17:51Z,2025-02-25T01:45:06Z
364474335,google/zx,43632,1122,2196,JavaScript,main,"bash, cli, javascript, nodejs, shell",11,"Apache License 2.0",https://github.com/google/zx,https://github.com/google,https://google.github.io/zx/,2021-05-05T05:50:01Z,2025-02-24T23:05:16Z
110058856,LeCoupa/awesome-cheatsheets,41706,6362,8957,JavaScript,master,"backend, bash, cheatsheet, cheatsheets, database, django, docker, feathersjs, frontend, javascript, kubernetes, language, nodejs, php, programming-language, redis, sailsjs, vim, vuejs, xcode",120,"MIT License",https://github.com/LeCoupa/awesome-cheatsheets,https://github.com/LeCoupa,https://lecoupa.github.io/awesome-cheatsheets/,2017-11-09T02:47:15Z,2025-02-24T23:30:57Z
80276391,GitSquared/edex-ui,41636,2667,31579,JavaScript,master,"desktop, edex-ui, electron, linux, macos, nodejs, science-fiction, shell, terminal, touchscreen, tron, unixporn, windows",6,"GNU General Public License v3.0",https://github.com/GitSquared/edex-ui,https://github.com/GitSquared,,2017-01-28T09:35:02Z,2025-02-24T23:53:57Z
649170660,Mintplex-Labs/anything-llm,38780,3723,44535,JavaScript,master,"agent-framework-javascript, ai-agents, crewai, custom-ai-agents, deepseek, deepseek-r1, desktop-app, llama3, llm, llm-application, llm-webui, lmstudio, local-llm, localai, multimodal, nodejs, ollama, rag, vector-database, webui",251,"MIT License",https://github.com/Mintplex-Labs/anything-llm,https://github.com/Mintplex-Labs,https://anythingllm.com,2023-06-04T02:29:14Z,2025-02-25T01:51:39Z
9393759,phaserjs/phaser,37590,7109,444893,JavaScript,master,"canvas, discord-activities, facebook-instant-games, game-development, game-frameworks, gamedev, html5-game-development, javascript, phaser, phaser-development, phaserjs, webgl, youtube-playables",86,"MIT License",https://github.com/phaserjs/phaser,https://github.com/phaserjs,https://phaser.io,2013-04-12T12:27:51Z,2025-02-24T22:41:59Z
42283287,preactjs/preact,37172,1967,17898,JavaScript,main,"components, dom, jsx, preact, react, vdom, virtual-dom",154,"MIT License",https://github.com/preactjs/preact,https://github.com/preactjs,https://preactjs.com,2015-09-11T02:40:18Z,2025-02-24T21:38:51Z
11551538,koajs/koa,35357,3224,3536,JavaScript,master,koa,28,"MIT License",https://github.com/koajs/koa,https://github.com/koajs,https://koajs.com,2013-07-20T18:53:45Z,2025-02-25T00:34:13Z
94498635,carbon-app/carbon,34917,1934,20154,JavaScript,main,"beautiful, carbon, education, github-gist, javascript, presentation, sharing, snippets, tweet",57,"MIT License",https://github.com/carbon-app/carbon,https://github.com/carbon-app,https://carbon.now.sh,2017-06-16T02:50:28Z,2025-02-24T19:58:22Z
21125024,typicode/husky,33139,1045,4438,JavaScript,main,"commit, git, hooks, pre-commit",73,"MIT License",https://github.com/typicode/husky,https://github.com/typicode,https://typicode.github.io/husky,2014-06-23T12:14:21Z,2025-02-25T01:47:32Z
33041711,ryanhanwu/How-To-Ask-Questions-The-Smart-Way,31972,5682,380,JavaScript,main,"rtfm, stfw, translation",7,"MIT License",https://github.com/ryanhanwu/How-To-Ask-Questions-The-Smart-Way,https://github.com/ryanhanwu,,2015-03-28T16:52:40Z,2025-02-25T01:56:24Z
164574693,qishibo/AnotherRedisDesktopManager,31620,2617,5443,JavaScript,master,"redis, redis-client, redis-cluster, redis-desktop-manager, redis-gui",135,"MIT License",https://github.com/qishibo/AnotherRedisDesktopManager,https://github.com/qishibo,,2019-01-08T06:01:56Z,2025-02-25T01:55:18Z
5405654,pcottle/learnGitBranching,31105,5804,48121,JavaScript,main,,43,"MIT License",https://github.com/pcottle/learnGitBranching,https://github.com/pcottle,https://pcottle.github.io/learnGitBranching/,2012-08-13T22:36:09Z,2025-02-24T16:14:49Z
42920477,layui/layui,29986,7404,14079,JavaScript,main,"component-library, css, html, javascript, layui, ui-kit, ui-library",47,"MIT License",https://github.com/layui/layui,https://github.com/layui,https://layui.dev,2015-09-22T08:12:03Z,2025-02-24T21:16:32Z
402046,parallax/jsPDF,29839,4710,110627,JavaScript,master,hacktoberfest,122,"MIT License",https://github.com/parallax/jsPDF,https://github.com/parallax,https://parall.ax/products/jspdf,2009-12-06T14:56:32Z,2025-02-24T21:28:25Z
712530,fabricjs/fabric.js,29676,3548,230400,JavaScript,master,,469,Other,https://github.com/fabricjs/fabric.js,https://github.com/fabricjs,http://fabricjs.com,2010-06-09T22:24:38Z,2025-02-24T21:32:55Z
95876775,elsewhencode/project-guidelines,29522,3218,507,JavaScript,master,"best-practices, guidelines, how-to, javascript, javascript-best-practices, maintainability",15,"MIT License",https://github.com/elsewhencode/project-guidelines,https://github.com/elsewhencode,,2017-06-30T10:17:55Z,2025-02-25T00:14:34Z
14098121,aosabook/500lines,29407,5868,60251,JavaScript,master,,61,Other,https://github.com/aosabook/500lines,https://github.com/aosabook,,2013-11-04T02:02:53Z,2025-02-24T23:53:32Z
30794868,sampotts/plyr,28342,3050,65933,JavaScript,master,"html5-video, javascript, plyr, vimeo, youtube",916,"MIT License",https://github.com/sampotts/plyr,https://github.com/sampotts,https://plyr.io,2015-02-14T11:33:07Z,2025-02-24T17:19:13Z
116392709,digitalocean/nginxconfig.io,27977,2063,9520,JavaScript,master,"cdn, digitalocean, digitalocean-community-tools, drupal, gzip, hacktoberfest, hsts, http2, https, letsencrypt, nginx, nginx-configs, nginx-configuration, php-fpm, rate-limiting, security, security-headers, ssl, ssl-certificate, wordpress",60,"MIT License",https://github.com/digitalocean/nginxconfig.io,https://github.com/digitalocean,https://do.co/nginxconfig,2018-01-05T14:21:14Z,2025-02-25T01:45:51Z
597879,Automattic/mongoose,27114,3852,135243,JavaScript,master,"mongo, mongodb, nodejs, odm, orm",220,"MIT License",https://github.com/Automattic/mongoose,https://github.com/Automattic,https://mongoosejs.com,2010-04-06T21:39:05Z,2025-02-24T23:08:28Z
2055965,swagger-api/swagger-ui,26978,9023,621091,JavaScript,master,"hacktoberfest, oas, open-source, openapi, openapi-specification, openapi3, openapi31, rest, rest-api, swagger, swagger-api, swagger-js, swagger-oss, swagger-ui",1249,"Apache License 2.0",https://github.com/swagger-api/swagger-ui,https://github.com/swagger-api,https://swagger.io,2011-07-15T22:56:39Z,2025-02-25T01:53:11Z
1254497,codemirror/codemirror5,26962,4962,19210,JavaScript,master,,432,"MIT License",https://github.com/codemirror/codemirror5,https://github.com/codemirror,http://codemirror.net/5/,2011-01-14T13:44:03Z,2025-02-24T09:28:09Z
299628763,Asabeneh/30-Days-Of-React,26475,7545,18709,JavaScript,master,"30dayofjavascript, challenge, css, html, html5, javascript, js, programming, react, react-router-dom, reactjs, redux, webdevelopment, website",237,,https://github.com/Asabeneh/30-Days-Of-React,https://github.com/Asabeneh,,2020-09-29T13:38:54Z,2025-02-24T23:16:05Z
958314,remy/nodemon,26461,1733,2698,JavaScript,main,"hacktoberfest, node, nodemon, watch",7,"MIT License",https://github.com/remy/nodemon,https://github.com/remy,http://nodemon.io/,2010-10-03T12:50:52Z,2025-02-24T23:16:32Z
43695474,quasarframework/quasar,26297,3577,447895,JavaScript,dev,"android, browser-extension, electron, ios, javascript, material, material-components, material-design, material-theme, pwa, quasar-framework, server-side-rendering, ssr, vue, vue-component, vue-components, vue3, vuejs, vuejs3",617,"MIT License",https://github.com/quasarframework/quasar,https://github.com/quasarframework,https://quasar.dev,2015-10-05T15:45:36Z,2025-02-24T20:58:04Z
3620194,select2/select2,25950,6254,14127,JavaScript,develop,"hacktoberfest, javascript, jquery, select2",144,"MIT License",https://github.com/select2/select2,https://github.com/select2,https://select2.org/,2012-03-04T18:43:12Z,2025-02-24T20:14:15Z
317757,Modernizr/Modernizr,25716,2977,19932,JavaScript,master,"css3-features, feature-detection, hacktoberfest, javascript, javascript-library, modernizr",192,"MIT License",https://github.com/Modernizr/Modernizr,https://github.com/Modernizr,https://www.npmjs.com/package/modernizr,2009-09-25T20:13:23Z,2025-02-24T22:43:03Z
11061773,eslint/eslint,25608,4650,43969,JavaScript,main,"ecmascript, eslint, javascript, linter, static-code-analysis",90,"MIT License",https://github.com/eslint/eslint,https://github.com/eslint,https://eslint.org,2013-06-29T23:59:48Z,2025-02-25T01:42:34Z
35640229,rollup/rollup,25605,1559,31543,JavaScript,master,,588,Other,https://github.com/rollup/rollup,https://github.com/rollup,https://rollupjs.org,2015-05-14T22:26:28Z,2025-02-25T00:34:00Z
566931318,fanmingming/live,24813,3794,410071,JavaScript,main,"china, converter, epg, iptv, ipv6, live, m3u, m3u8, mp4, radio, television, tv, txt, workers",12,"GNU General Public License v3.0",https://github.com/fanmingming/live,https://github.com/fanmingming,https://live.fanmingming.com/,2022-11-16T18:03:31Z,2025-02-25T00:34:30Z
965782,validatorjs/validator.js,23342,2337,5116,JavaScript,master,"hacktoberfest, input, javascript, node, sanitization, sanitize, validate, validation, validations, validator",354,"MIT License",https://github.com/validatorjs/validator.js,https://github.com/validatorjs,,2010-10-06T06:58:48Z,2025-02-24T09:17:10Z
15975439,jlmakes/scrollreveal,22498,2246,1140,JavaScript,master,"animation, css, javascript, reveal, scroll, scrollreveal, transform, transition",42,,https://github.com/jlmakes/scrollreveal,https://github.com/jlmakes,https://scrollrevealjs.org/,2014-01-16T17:37:20Z,2025-02-24T15:00:15Z
33895378,bevacqua/dragula,22147,1966,1959,JavaScript,master,"component, drag-and-drop, drag-drop, dragging, front-end, javascript, vanilla",157,"MIT License",https://github.com/bevacqua/dragula,https://github.com/bevacqua,https://bevacqua.github.io/dragula/,2015-04-13T21:35:38Z,2025-02-25T00:12:20Z
2051226,eligrey/FileSaver.js,21783,4384,356,JavaScript,master,,211,Other,https://github.com/eligrey/FileSaver.js,https://github.com/eligrey,https://eligrey.com/blog/saving-generated-files-on-the-client-side/,2011-07-15T03:27:54Z,2025-02-24T13:32:44Z
37246537,chenglou/react-motion,21748,1155,5349,JavaScript,master,,193,"MIT License",https://github.com/chenglou/react-motion,https://github.com/chenglou,,2015-06-11T07:38:23Z,2025-02-24T14:44:40Z
24063576,semantic-release/semantic-release,21499,1706,7339,JavaScript,master,"automation, changelog, package, publish, release, release-automation, release-workflow, semantic-release, semantic-version, semver, semver-release, version",369,"MIT License",https://github.com/semantic-release/semantic-release,https://github.com/semantic-release,https://semantic-release.gitbook.io,2014-09-15T16:18:28Z,2025-02-24T15:16:08Z
18964487,ruanyf/es6tutorial,21367,8955,5764,JavaScript,gh-pages,,0,Other,https://github.com/ruanyf/es6tutorial,https://github.com/ruanyf,http://es6.ruanyifeng.com/,2014-04-20T13:06:28Z,2025-02-25T01:23:47Z
5830987,hapijs/joi,21045,1512,10167,JavaScript,master,"hapi, javascript, schema, validation",184,Other,https://github.com/hapijs/joi,https://github.com/hapijs,,2012-09-16T16:38:06Z,2025-02-24T22:29:48Z
16989371,MagicMirrorOrg/MagicMirror,21013,4286,24411,JavaScript,master,"domotics, javascript, magicmirror, mirror, raspberry-pi, smarthome",31,"MIT License",https://github.com/MagicMirrorOrg/MagicMirror,https://github.com/MagicMirrorOrg,http://magicmirror.builders,2014-02-19T15:48:09Z,2025-02-24T22:44:44Z
23141830,paularmstrong/normalizr,20943,869,2471,JavaScript,master,"api, flux, javascript, json, normalize, normalizr, reactjs, redux",22,"MIT License",https://github.com/paularmstrong/normalizr,https://github.com/paularmstrong,,2014-08-20T08:41:38Z,2025-02-23T08:51:56Z
28538501,react-grid-layout/react-grid-layout,20883,2617,15311,JavaScript,master,"drag-and-drop, es2015, grid, javascript, react, resize",229,"MIT License",https://github.com/react-grid-layout/react-grid-layout,https://github.com/react-grid-layout,https://react-grid-layout.github.io/react-grid-layout/examples/0-showcase.html,2014-12-27T14:28:40Z,2025-02-24T14:42:33Z
478584,jsdom/jsdom,20808,1724,45750,JavaScript,main,"dom-apis, html, javascript, jsdom, nodejs",533,"MIT License",https://github.com/jsdom/jsdom,https://github.com/jsdom,,2010-01-19T06:55:19Z,2025-02-25T01:17:42Z
62104779,SortableJS/Vue.Draggable,20293,2891,15158,JavaScript,master,"component, drag-and-drop, vue",284,"MIT License",https://github.com/SortableJS/Vue.Draggable,https://github.com/SortableJS,https://sortablejs.github.io/Vue.Draggable/,2016-06-28T02:50:19Z,2025-02-25T01:27:38Z
69798748,verekia/js-stack-from-scratch,20097,1990,1808,JavaScript,master,"bootstrap, eslint, flow, heroku, immutablejs, javascript, jest, jss, nodemon, pm2, react, react-router, redux, server-side-rendering, sinon, socket-io, stack, tutorial, webpack, yarn",49,"MIT License",https://github.com/verekia/js-stack-from-scratch,https://github.com/verekia,,2016-10-02T13:31:23Z,2025-02-24T00:47:13Z
39315600,be5invis/Iosevka,19829,592,12560789,JavaScript,main,"font, iosevka, ligatures, monospace-font, opentype-features, programming-font, programming-ligatures, typeface",96,"SIL Open Font License 1.1",https://github.com/be5invis/Iosevka,https://github.com/be5invis,http://be5invis.github.io/Iosevka,2015-07-18T23:10:59Z,2025-02-24T23:28:26Z
159981830,spicetify/cli,19577,745,7000,JavaScript,main,"command-line, command-line-tool, customization, golang, hacktoberfest, linux, macos, spicetify-cli, spicetify-extensions, spotify, windows",9,"GNU Lesser General Public License v2.1",https://github.com/spicetify/cli,https://github.com/spicetify,https://spicetify.app,2018-12-01T19:55:18Z,2025-02-24T23:53:14Z
9690430,nuysoft/Mock,19571,2658,5409,JavaScript,refactoring,,340,Other,https://github.com/nuysoft/Mock,https://github.com/nuysoft,http://mockjs.com,2013-04-26T08:06:57Z,2025-02-24T07:30:24Z
172741073,FredKSchott/snowpack,19459,916,82221,JavaScript,main,,389,"MIT License",https://github.com/FredKSchott/snowpack,https://github.com/FredKSchott,https://www.snowpack.dev,2019-02-26T15:45:38Z,2025-02-24T23:21:42Z
125863507,testing-library/react-testing-library,19171,1119,1640,JavaScript,main,"javascript, reactjs, testing",52,"MIT License",https://github.com/testing-library/react-testing-library,https://github.com/testing-library,https://testing-library.com/react,2018-03-19T13:39:49Z,2025-02-24T23:04:26Z
137583435,adam-golab/react-developer-roadmap,18931,2033,15786,JavaScript,master,,36,Other,https://github.com/adam-golab/react-developer-roadmap,https://github.com/adam-golab,,2018-06-16T13:40:50Z,2025-02-24T02:12:38Z
48242990,SnapDrop/snapdrop,18819,1761,3571,JavaScript,master,"pwa, snapdrop, webrtc",293,"GNU General Public License v3.0",https://github.com/SnapDrop/snapdrop,https://github.com/SnapDrop,https://snapdrop.net,2015-12-18T15:44:18Z,2025-02-24T22:58:44Z
243546335,tabler/tabler-icons,18805,950,1130239,JavaScript,main,"bootstrap-icons, components, css, icon, icon-pack, icons, icons-pack, iconset, quality-svg-icons, react, svelte, svg, svg-icons, tabler-icons",303,"MIT License",https://github.com/tabler/tabler-icons,https://github.com/tabler,https://tabler.io/icons,2020-02-27T15:10:04Z,2025-02-24T23:03:32Z
11195700,KaTeX/KaTeX,18741,1204,87067,JavaScript,main,"javascript, katex, latex, math, math-typesetting",422,"MIT License",https://github.com/KaTeX/KaTeX,https://github.com/KaTeX,https://katex.org,2013-07-05T09:01:54Z,2025-02-25T01:17:00Z
84703916,chaozh/awesome-blockchain-cn,18606,3616,228,JavaScript,master,,4,"Apache License 2.0",https://github.com/chaozh/awesome-blockchain-cn,https://github.com/chaozh,,2017-03-12T06:02:46Z,2025-02-24T21:16:58Z
17107479,framework7io/framework7,18281,3233,101705,JavaScript,master,"android, components, cordova, framework, ios, library, material, material-design, mobile, phonegap, touch",207,"MIT License",https://github.com/framework7io/framework7,https://github.com/framework7io,http://framework7.io,2014-02-23T12:15:53Z,2025-02-24T10:14:48Z
105036236,Shopify/draggable,18143,1095,6469,JavaScript,main,"drag-and-drop, draggable, es6, javascript",148,"MIT License",https://github.com/Shopify/draggable,https://github.com/Shopify,https://shopify.github.io/draggable,2017-09-27T15:31:23Z,2025-02-24T13:12:35Z
115229134,mdx-js/mdx,18100,1147,44337,JavaScript,main,"jsx, markdown, mdx, react, remark, unified, vue",10,"MIT License",https://github.com/mdx-js/mdx,https://github.com/mdx-js,https://mdxjs.com,2017-12-24T00:01:48Z,2025-02-24T17:23:15Z
30102273,MobSF/Mobile-Security-Framework-MobSF,18085,3311,1525246,JavaScript,master,"android-security, api-testing, apk, cwe, devsecops, dynamic-analysis, ios-security, malware-analysis, mastg, masvs, mobile-security, mobsf, mstg, owasp, rest, runtime-security, static-analysis, web-security, windows-mobile-security",15,"GNU General Public License v3.0",https://github.com/MobSF/Mobile-Security-Framework-MobSF,https://github.com/MobSF,https://opensecurity.in,2015-01-31T04:36:01Z,2025-02-24T23:14:52Z
59114705,nosir/cleave.js,17940,1610,3076,JavaScript,master,"credit-card, creditcard, input, input-mask, telephone-number",218,"Apache License 2.0",https://github.com/nosir/cleave.js,https://github.com/nosir,http://nosir.github.io/cleave.js,2016-05-18T12:45:03Z,2025-02-22T01:48:36Z
28748255,sweetalert2/sweetalert2,17547,1629,21487,JavaScript,main,"accessible, alert, angular, confirm, confirmation-dialog, dialog, modal, notifications, popup, prompt, react, sweetalert, sweetalert2, toast, vue, wai-aria",12,"MIT License",https://github.com/sweetalert2/sweetalert2,https://github.com/sweetalert2,https://sweetalert2.github.io,2015-01-03T16:15:52Z,2025-02-24T15:02:42Z
22046023,facebookarchive/flux,17498,3449,5493,JavaScript,main,,6,Other,https://github.com/facebookarchive/flux,https://github.com/facebookarchive,https://facebookarchive.github.io/flux/,2014-07-20T23:33:08Z,2025-02-23T06:53:52Z
369764441,wg-easy/wg-easy,17482,1691,4106,JavaScript,master,,16,Other,https://github.com/wg-easy/wg-easy,https://github.com/wg-easy,,2021-05-22T09:12:05Z,2025-02-24T22:36:38Z
137946752,nondanee/UnblockNeteaseMusic,17451,2514,1775,JavaScript,master,"netease-cloud-music, proxy-server, unblocker",214,"MIT License",https://github.com/nondanee/UnblockNeteaseMusic,https://github.com/nondanee,,2018-06-19T21:18:41Z,2025-02-25T01:56:36Z
18611173,julianshapiro/velocity,17299,1559,8139,JavaScript,master,,41,"MIT License",https://github.com/julianshapiro/velocity,https://github.com/julianshapiro,VelocityJS.org,2014-04-09T20:02:38Z,2025-02-24T04:14:21Z
527644,less/less.js,17047,3403,16686,JavaScript,master,"css, language, stylesheet-language",220,"Apache License 2.0",https://github.com/less/less.js,https://github.com/less,http://lesscss.org,2010-02-20T17:25:38Z,2025-02-23T05:23:08Z
53266139,BoostIO/BoostNote-Legacy,17047,1461,19251,JavaScript,master,"electron, linux, macos, open-source, react, stylus, windows",502,Other,https://github.com/BoostIO/BoostNote-Legacy,https://github.com/BoostIO,,2016-03-06T17:06:07Z,2025-02-23T11:56:34Z
30161665,infernojs/inferno,16112,634,45428,JavaScript,master,"inferno, inferno-component, inferno-js, javascript-library, jsx, performance, react, vdom",38,"MIT License",https://github.com/infernojs/inferno,https://github.com/infernojs,https://infernojs.org,2015-02-01T22:07:38Z,2025-02-24T14:39:06Z
47118129,moment/luxon,15706,748,98142,JavaScript,master,"dates, datetime, intl, times, timezones",187,"MIT License",https://github.com/moment/luxon,https://github.com/moment,https://moment.github.io/luxon,2015-11-30T12:48:48Z,2025-02-24T22:00:53Z
141910081,faressoft/terminalizer,15521,505,4118,JavaScript,master,"animated, bash, bash-profile, capture, colors, command-line, font, generate, gif, powershell, pty, record, render, repeat, shell, shot, terminal, theme, tty, zsh",107,"MIT License",https://github.com/faressoft/terminalizer,https://github.com/faressoft,https://terminalizer.com,2018-07-22T16:00:15Z,2025-02-25T00:33:24Z
58616946,SimulatedGREG/electron-vue,15479,1544,5927,JavaScript,master,"babel, boilerplate, documentation, electron, electron-builder, electron-packager, end-to-end-testing, es6, unit-testing, vue, vue-cli, webpack",282,"MIT License",https://github.com/SimulatedGREG/electron-vue,https://github.com/SimulatedGREG,https://simulatedgreg.gitbooks.io/electron-vue/content/,2016-05-12T07:08:12Z,2025-02-24T04:43:49Z
270722949,lucide-icons/lucide,15247,672,13499,JavaScript,main,"feather-icons, figma, icons, react, svg, svg-icons, svgs, ui-components, ui-design, vue",287,"ISC License",https://github.com/lucide-icons/lucide,https://github.com/lucide-icons,https://lucide.dev,2020-06-08T15:36:21Z,2025-02-25T01:55:24Z
